{
  "counts": {
    "invalid_coordinate_regions": 0,
    "negative_candidate": 1209,
    "order_candidate": 0,
    "order_disorder_conflict": 296,
    "other_disorder_function_candidate": 1209,
    "positive": 14304,
    "positive_order_conflict": 49,
    "positive_other_function_overlap": 382,
    "proteins": 329,
    "residues": 233315,
    "unknown": 217802
  },
  "proteins": [
    {
      "disprot_id": "DP00009",
      "negative_candidate": 0,
      "order_candidate": 0,
      "order_disorder_conflict": 0,
      "other_disorder_function_candidate": 0,
      "positive": 15,
      "positive_order_conflict": 0,
      "positive_other_function_overlap": 0,
      "residues": 122,
      "uniprot_accession": "P32774",
      "unknown": 107
    },
    {
      "disprot_id": "DP00011",
      "negative_candidate": 0,
      "order_candidate": 0,
      "order_disorder_conflict": 0,
      "other_disorder_function_candidate": 0,
      "positive": 14,
      "positive_order_conflict": 0,
      "positive_other_function_overlap": 0,
      "residues": 295,
      "uniprot_accession": "P0DMM9",
      "unknown": 281
    },
    {
      "disprot_id": "DP00018",
      "negative_candidate": 21,
      "order_candidate": 0,
      "order_disorder_conflict": 0,
      "other_disorder_function_candidate": 21,
      "positive": 22,
      "positive_order_conflict": 0,
      "positive_other_function_overlap": 8,
      "residues": 198,
      "uniprot_accession": "P46527",
      "unknown": 155
    },
    {
      "disprot_id": "DP00023",
      "negative_candidate": 0,
      "order_candidate": 0,
      "order_disorder_conflict": 0,
      "other_disorder_function_candidate": 0,
      "positive": 9,
      "positive_order_conflict": 0,
      "positive_other_function_overlap": 0,
      "residues": 328,
      "uniprot_accession": "P14061",
      "unknown": 319
    },
    {
      "disprot_id": "DP00034",
      "negative_candidate": 0,
      "order_candidate": 0,
      "order_disorder_conflict": 0,
      "other_disorder_function_candidate": 0,
      "positive": 22,
      "positive_order_conflict": 0,
      "positive_other_function_overlap": 0,
      "residues": 424,
      "uniprot_accession": "P03661",
      "unknown": 402
    },
    {
      "disprot_id": "DP00040",
      "negative_candidate": 23,
      "order_candidate": 0,
      "order_disorder_conflict": 0,
      "other_disorder_function_candidate": 23,
      "positive": 11,
      "positive_order_conflict": 0,
      "positive_other_function_overlap": 9,
      "residues": 107,
      "uniprot_accession": "P17096",
      "unknown": 73
    },
    {
      "disprot_id": "DP00048",
      "negative_candidate": 0,
      "order_candidate": 0,
      "order_disorder_conflict": 0,
      "other_disorder_function_candidate": 0,
      "positive": 30,
      "positive_order_conflict": 0,
      "positive_other_function_overlap": 0,
      "residues": 206,
      "uniprot_accession": "P03406",
      "unknown": 176
    },
    {
      "disprot_id": "DP00061",
      "negative_candidate": 0,
      "order_candidate": 0,
      "order_disorder_conflict": 0,
      "other_disorder_function_candidate": 0,
      "positive": 76,
      "positive_order_conflict": 0,
      "positive_other_function_overlap": 0,
      "residues": 616,
      "uniprot_accession": "P27694",
      "unknown": 540
    },
    {
      "disprot_id": "DP00075",
      "negative_candidate": 0,
      "order_candidate": 0,
      "order_disorder_conflict": 0,
      "other_disorder_function_candidate": 0,
      "positive": 77,
      "positive_order_conflict": 0,
      "positive_other_function_overlap": 0,
      "residues": 765,
      "uniprot_accession": "P11387",
      "unknown": 688
    },
    {
      "disprot_id": "DP00098",
      "negative_candidate": 0,
      "order_candidate": 0,
      "order_disorder_conflict": 0,
      "other_disorder_function_candidate": 0,
      "positive": 10,
      "positive_order_conflict": 0,
      "positive_other_function_overlap": 0,
      "residues": 1183,
      "uniprot_accession": "Q53654",
      "unknown": 1173
    },
    {
      "disprot_id": "DP00111",
      "negative_candidate": 21,
      "order_candidate": 0,
      "order_disorder_conflict": 0,
      "other_disorder_function_candidate": 21,
      "positive": 58,
      "positive_order_conflict": 0,
      "positive_other_function_overlap": 0,
      "residues": 440,
      "uniprot_accession": "P27577",
      "unknown": 361
    },
    {
      "disprot_id": "DP00133",
      "negative_candidate": 0,
      "order_candidate": 0,
      "order_disorder_conflict": 0,
      "other_disorder_function_candidate": 0,
      "positive": 81,
      "positive_order_conflict": 0,
      "positive_other_function_overlap": 0,
      "residues": 507,
      "uniprot_accession": "P03422",
      "unknown": 426
    },
    {
      "disprot_id": "DP00135",
      "negative_candidate": 0,
      "order_candidate": 0,
      "order_disorder_conflict": 0,
      "other_disorder_function_candidate": 0,
      "positive": 73,
      "positive_order_conflict": 0,
      "positive_other_function_overlap": 0,
      "residues": 833,
      "uniprot_accession": "P10961",
      "unknown": 760
    },
    {
      "disprot_id": "DP00156",
      "negative_candidate": 0,
      "order_candidate": 0,
      "order_disorder_conflict": 0,
      "other_disorder_function_candidate": 0,
      "positive": 147,
      "positive_order_conflict": 0,
      "positive_other_function_overlap": 0,
      "residues": 363,
      "uniprot_accession": "P54725",
      "unknown": 216
    },
    {
      "disprot_id": "DP00161",
      "negative_candidate": 0,
      "order_candidate": 0,
      "order_disorder_conflict": 0,
      "other_disorder_function_candidate": 0,
      "positive": 157,
      "positive_order_conflict": 0,
      "positive_other_function_overlap": 0,
      "residues": 328,
      "uniprot_accession": "P77173",
      "unknown": 171
    },
    {
      "disprot_id": "DP00162",
      "negative_candidate": 0,
      "order_candidate": 0,
      "order_disorder_conflict": 0,
      "other_disorder_function_candidate": 0,
      "positive": 27,
      "positive_order_conflict": 0,
      "positive_other_function_overlap": 0,
      "residues": 88,
      "uniprot_accession": "O75324",
      "unknown": 61
    },
    {
      "disprot_id": "DP00166",
      "negative_candidate": 0,
      "order_candidate": 0,
      "order_disorder_conflict": 0,
      "other_disorder_function_candidate": 0,
      "positive": 12,
      "positive_order_conflict": 0,
      "positive_other_function_overlap": 0,
      "residues": 210,
      "uniprot_accession": "P19429",
      "unknown": 198
    },
    {
      "disprot_id": "DP00194",
      "negative_candidate": 0,
      "order_candidate": 0,
      "order_disorder_conflict": 0,
      "other_disorder_function_candidate": 0,
      "positive": 43,
      "positive_order_conflict": 0,
      "positive_other_function_overlap": 0,
      "residues": 165,
      "uniprot_accession": "P0AFZ3",
      "unknown": 122
    },
    {
      "disprot_id": "DP00197",
      "negative_candidate": 0,
      "order_candidate": 0,
      "order_disorder_conflict": 0,
      "other_disorder_function_candidate": 0,
      "positive": 12,
      "positive_order_conflict": 0,
      "positive_other_function_overlap": 0,
      "residues": 180,
      "uniprot_accession": "P0A707",
      "unknown": 168
    },
    {
      "disprot_id": "DP00226",
      "negative_candidate": 0,
      "order_candidate": 0,
      "order_disorder_conflict": 0,
      "other_disorder_function_candidate": 0,
      "positive": 30,
      "positive_order_conflict": 0,
      "positive_other_function_overlap": 0,
      "residues": 229,
      "uniprot_accession": "Q9CXW3",
      "unknown": 199
    },
    {
      "disprot_id": "DP00231",
      "negative_candidate": 0,
      "order_candidate": 0,
      "order_disorder_conflict": 0,
      "other_disorder_function_candidate": 0,
      "positive": 25,
      "positive_order_conflict": 0,
      "positive_other_function_overlap": 0,
      "residues": 743,
      "uniprot_accession": "P14859",
      "unknown": 718
    },
    {
      "disprot_id": "DP00243",
      "negative_candidate": 0,
      "order_candidate": 0,
      "order_disorder_conflict": 0,
      "other_disorder_function_candidate": 0,
      "positive": 14,
      "positive_order_conflict": 0,
      "positive_other_function_overlap": 0,
      "residues": 273,
      "uniprot_accession": "P23025",
      "unknown": 259
    },
    {
      "disprot_id": "DP00284",
      "negative_candidate": 0,
      "order_candidate": 0,
      "order_disorder_conflict": 0,
      "other_disorder_function_candidate": 0,
      "positive": 16,
      "positive_order_conflict": 0,
      "positive_other_function_overlap": 16,
      "residues": 575,
      "uniprot_accession": "P16009",
      "unknown": 559
    },
    {
      "disprot_id": "DP00298",
      "negative_candidate": 0,
      "order_candidate": 0,
      "order_disorder_conflict": 0,
      "other_disorder_function_candidate": 0,
      "positive": 53,
      "positive_order_conflict": 0,
      "positive_other_function_overlap": 53,
      "residues": 233,
      "uniprot_accession": "Q07817",
      "unknown": 180
    },
    {
      "disprot_id": "DP00315",
      "negative_candidate": 0,
      "order_candidate": 0,
      "order_disorder_conflict": 0,
      "other_disorder_function_candidate": 0,
      "positive": 15,
      "positive_order_conflict": 0,
      "positive_other_function_overlap": 0,
      "residues": 458,
      "uniprot_accession": "O43464",
      "unknown": 443
    },
    {
      "disprot_id": "DP00324",
      "negative_candidate": 5,
      "order_candidate": 0,
      "order_disorder_conflict": 0,
      "other_disorder_function_candidate": 5,
      "positive": 11,
      "positive_order_conflict": 0,
      "positive_other_function_overlap": 5,
      "residues": 372,
      "uniprot_accession": "P09651",
      "unknown": 356
    },
    {
      "disprot_id": "DP00352",